,タクソノミ,冗長ラベル（日本語）,標準ラベル（英語）,冗長ラベル（英語）
328,jppfs_cor:NetIncreaseDecreaseInForeignExchangesLiabilitiesOpeCFBNK,外国為替（負債）の純増減（△）、営業活動によるキャッシュ・フロー、銀行業,Net increase (decrease) in foreign exchanges - liabilities,Net increase (decrease) in foreign exchanges-liabilities-OpeCF-BNK
329,jppfs_cor:LossGainOnMoneyHeldInTrustOpeCFBNK,金銭の信託の運用損益（△は運用益）、営業活動によるキャッシュ・フロー、銀行業,Loss (gain) on money held in trust,Loss (gain) on money held in trust-OpeCF-BNK
330,jppfs_cor:NetDecreaseIncreaseInMoneyHeldInTrustOpeCFBNK,金銭の信託の純増（△）減、営業活動によるキャッシュ・フロー、銀行業,Net decrease (increase) in money held in trust,Net decrease (increase) in money held in trust-OpeCF-BNK
331,jppfs_cor:NetIncreaseDecreaseInDebenturesOpeCFBNK,債券の純増減（△）、営業活動によるキャッシュ・フロー、銀行業,Net increase (decrease) in debentures,Net increase (decrease) in debentures-OpeCF-BNK
332,jppfs_cor:NetIncreaseDecreaseInPayablesUnderSecuritiesLendingTransactionsOpeCFBNK,債券貸借取引受入担保金の純増減（△）、営業活動によるキャッシュ・フロー、銀行業,Net increase (decrease) in payables under securities lending transactions,Net increase (decrease) in payables under securities lending transactions-OpeCF-BNK
333,jppfs_cor:NetIncreaseDecreaseInBorrowedMoneyExcludingSubordinatedBorrowingsOpeCFBNK,借用金（劣後特約付借入金を除く）の純増減（△）、営業活動によるキャッシュ・フロー、銀行業,Net increase (decrease) in borrowed money (excluding subordinated borrowings),Net increase (decrease) in borrowed money (excluding subordinated borrowings)-OpeCF-BNK
334,jppfs_cor:NetIncreaseDecreaseInBorrowedMoneyOpeCFBNK,借用金の純増減（△）、営業活動によるキャッシュ・フロー、銀行業,Net increase (decrease) in borrowed money,Net increase (decrease) in borrowed money-OpeCF-BNK
335,jppfs_cor:NetIncreaseDecreaseInNegotiableCertificatesOfDepositOpeCFBNK,譲渡性預金の純増減（△）、営業活動によるキャッシュ・フロー、銀行業,Net increase (decrease) in negotiable certificates of deposit,Net increase (decrease) in negotiable certificates of deposit-OpeCF-BNK
336,jppfs_cor:NetIncreaseDecreaseInBorrowedMoneyFromTrustAccountOpeCFBNK,信託勘定借の純増減（△）、営業活動によるキャッシュ・フロー、銀行業,Net increase (decrease) in borrowed money from trust account,Net increase (decrease) in borrowed money from trust account-OpeCF-BNK
337,jppfs_cor:IncreaseDecreaseInProvisionForTrustCapitalFillingOpeCFBNK,信託元本補填引当金の増減（△）、営業活動によるキャッシュ・フロー、銀行業,Increase (decrease) in provision for trust capital filling,Increase (decrease) in provision for trust capital filling-OpeCF-BNK
338,jppfs_cor:IncreaseDecreaseInProvisionForPossibleLossOnSupportOfSpecificBorrowersOpeCFBNK,特定債務者支援引当金の増減（△）、営業活動によるキャッシュ・フロー、銀行業,Increase (decrease) in provision for possible loss on support of specific borrowers,Increase (decrease) in provision for possible loss on support of specific borrowers-OpeCF-BNK
339,jppfs_cor:IncreaseDecreaseInProvisionForContingentLossOpeCFBNK,偶発損失引当金の増減（△）、営業活動によるキャッシュ・フロー、銀行業,Increase (decrease) in provision for contingent loss,Increase (decrease) in provision for contingent loss-OpeCF-BNK
340,jppfs_cor:NetDecreaseIncreaseInTradingAssetsOpeCFBNK,特定取引資産の純増（△）減、営業活動によるキャッシュ・フロー、銀行業,Net decrease (increase) in trading assets,Net decrease (increase) in trading assets-OpeCF-BNK
341,jppfs_cor:NetIncreaseDecreaseInTradingLiabilitiesOpeCFBNK,特定取引負債の純増減（△）、営業活動によるキャッシュ・フロー、銀行業,Net increase (decrease) in trading liabilities,Net increase (decrease) in trading liabilities-OpeCF-BNK
342,jppfs_cor:NetDecreaseIncreaseInMonetaryClaimsBoughtOpeCFBNK,買入金銭債権の純増（△）減、営業活動によるキャッシュ・フロー、銀行業,Net decrease (increase) in monetary claims bought,Net decrease (increase) in monetary claims bought-OpeCF-BNK
343,jppfs_cor:IncreaseDecreaseInStraightBondsIssuanceAndRedemptionOpeCFBNK,普通社債発行及び償還による増減（△）、営業活動によるキャッシュ・フロー、銀行業,Increase (decrease) in straight bonds - issuance and redemption,Increase (decrease) in straight bonds-issuance and redemption-OpeCF-BNK
344,jppfs_cor:AdjustmentOfUnsettledTradingAccountsOpeCFBNK,約定済未決済特定取引調整額、営業活動によるキャッシュ・フロー、銀行業,Adjustment of unsettled trading accounts,Adjustment of unsettled trading accounts-OpeCF-BNK
345,jppfs_cor:NetDecreaseIncreaseInInterestBearingDepositOpeCFBNK,有利息預け金の純増（△）減、営業活動によるキャッシュ・フロー、銀行業,Net decrease (increase) in interest-bearing deposit,Net decrease (increase) in interest-bearing deposit-OpeCF-BNK
346,jppfs_cor:NetDecreaseIncreaseInDepositExcludingCashEquivalentOpeCFBNK,預け金（現金同等物を除く）の純増（△）減、営業活動によるキャッシュ・フロー、銀行業,Net decrease (increase) in deposit (excluding cash equivalent),Net decrease (increase) in deposit (excluding cash equivalent)-OpeCF-BNK
347,jppfs_cor:NetDecreaseIncreaseInDepositExcludingDepositPaidToBankOfJapanOpeCFBNK,預け金（日銀預け金を除く）の純増（△）減、営業活動によるキャッシュ・フロー、銀行業,Net decrease (increase) in deposit (excluding deposit paid to Bank of Japan),Net decrease (increase) in deposit (excluding deposit paid to Bank of Japan)-OpeCF-BNK
348,jppfs_cor:NetDecreaseIncreaseInDepositOpeCFBNK,預け金の純増（△）減、営業活動によるキャッシュ・フロー、銀行業,Net decrease (increase) in deposit,Net decrease (increase) in deposit-OpeCF-BNK
349,jppfs_cor:NetDecreaseIncreaseInReceivablesUnderSecuritiesBorrowingTransactionsOpeCFBNK,債券貸借取引支払保証金の純増（△）減、営業活動によるキャッシュ・フロー、銀行業,Net decrease (increase) in receivables under securities borrowing transactions,Net decrease (increase) in receivables under securities borrowing transactions-OpeCF-BNK
350,jppfs_cor:NetIncreaseDecreaseInShortTermCorporateBondsOpeCFBNK,短期社債（負債）の純増減（△）、営業活動によるキャッシュ・フロー、銀行業,Net increase (decrease) in short-term corporate bonds,Net increase (decrease) in short-term corporate bonds-OpeCF-BNK
351,jppfs_cor:NetDecreaseIncreaseInSecuritiesTradingOpeCFBNK,売買目的有価証券の純増（△）減、営業活動によるキャッシュ・フロー、銀行業,Net decrease (increase) in securities - trading,Net decrease (increase) in securities-trading-OpeCF-BNK
352,jppfs_cor:NetDecreaseIncreaseInDepositOver3MonthsOpeCFBNK,預け金（預入期間三ヶ月超）の純増（△）減、営業活動によるキャッシュ・フロー、銀行業,Net decrease (increase) in deposit (over 3 months),Net decrease (increase) in deposit (over 3 months)-OpeCF-BNK
353,jppfs_cor:NetDecreaseIncreaseInLeaseReceivablesAndInvestmentAssetsOpeCFBNK,リース債権及びリース投資資産の純増（△）減、営業活動によるキャッシュ・フロー、銀行業,Net decrease (increase) in lease receivables and investment assets,Net decrease (increase) in lease receivables and investment assets-OpeCF-BNK
354,jppfs_cor:IncomeTaxesPaidOpeCF,法人税等の支払額、営業活動によるキャッシュ・フロー,Income taxes paid,Income taxes paid-OpeCF
355,jppfs_cor:NetCashProvidedByUsedInOperatingActivities,営業活動によるキャッシュ・フロー,Net cash provided by (used in) operating activities,Net cash provided by (used in) operating activities
356,jppfs_cor:NetCashProvidedByUsedInInvestmentActivitiesAbstract,投資活動によるキャッシュ・フロー [タイトル項目],Cash flows from investing activities,Cash flows from investing activities [abstract]
357,jppfs_cor:PurchaseOfSecuritiesInvCFBNK,有価証券の取得による支出、投資活動によるキャッシュ・フロー、銀行業,Purchase of securities,Purchase of securities-InvCF-BNK
358,jppfs_cor:ProceedsFromSalesOfSecuritiesInvCFBNK,有価証券の売却による収入、投資活動によるキャッシュ・フロー、銀行業,Proceeds from sales of securities,Proceeds from sales of securities-InvCF-BNK
359,jppfs_cor:PurchaseOfPropertyPlantAndEquipmentInvCF,有形固定資産の取得による支出、投資活動によるキャッシュ・フロー,"Purchase of property, plant and equipment","Purchase of property, plant and equipment-InvCF"
360,jppfs_cor:ProceedsFromSalesOfPropertyPlantAndEquipmentInvCF,有形固定資産の売却による収入、投資活動によるキャッシュ・フロー,"Proceeds from sales of property, plant and equipment","Proceeds from sales of property, plant and equipment-InvCF"
361,jppfs_cor:DecreaseInMoneyHeldInTrustInvCFBNK,金銭の信託の減少による収入、投資活動によるキャッシュ・フロー、銀行業,Decrease in money held in trust,Decrease in money held in trust-InvCF-BNK
362,jppfs_cor:IncreaseInMoneyHeldInTrustInvCFBNK,金銭の信託の増加による支出、投資活動によるキャッシュ・フロー、銀行業,Increase in money held in trust,Increase in money held in trust-InvCF-BNK
363,jppfs_cor:ProceedsFromFundManagementAsInvestmentActivitiesInvCFBNK,投資活動としての資金運用による収入、投資活動によるキャッシュ・フロー、銀行業,Proceeds from fund management as investing activities,Proceeds from fund management as investing activities-InvCF-BNK
364,jppfs_cor:PaymentsForMoneyHeldInTrustInvCFBNK,金銭の信託の設定による支出、投資活動によるキャッシュ・フロー、銀行業,Payments for money held in trust,Payments for money held in trust-InvCF-BNK
365,jppfs_cor:ProceedsFromCancellationAndDividendsOfMoneyHeldInTrustInvCFBNK,金銭の信託の解約及び配当による収入、投資活動によるキャッシュ・フロー、銀行業,Proceeds from cancellation and dividends of money held in trust,Proceeds from cancellation and dividends of money held in trust-InvCF-BNK
366,jppfs_cor:ProceedsFromRedemptionOfSecuritiesInvCFBNK,有価証券の償還による収入、投資活動によるキャッシュ・フロー、銀行業,Proceeds from redemption of securities,Proceeds from redemption of securities-InvCF-BNK
367,jppfs_cor:NetCashProvidedByUsedInInvestmentActivities,投資活動によるキャッシュ・フロー,Net cash provided by (used in) investing activities,Net cash provided by (used in) investing activities
368,jppfs_cor:NetCashProvidedByUsedInFinancingActivitiesAbstract,財務活動によるキャッシュ・フロー [タイトル項目],Cash flows from financing activities,Cash flows from financing activities [abstract]
369,jppfs_cor:ProceedsFromIssuanceOfCommonStockFinCF,株式の発行による収入、財務活動によるキャッシュ・フロー,Proceeds from issuance of common shares,Proceeds from issuance of common shares-FinCF
370,jppfs_cor:PurchaseOfTreasuryStockFinCF,自己株式の取得による支出、財務活動によるキャッシュ・フロー,Purchase of treasury shares,Purchase of treasury shares-FinCF
371,jppfs_cor:CashDividendsPaidFinCF,配当金の支払額、財務活動によるキャッシュ・フロー,Cash dividends paid,Cash dividends paid-FinCF
372,jppfs_cor:DividendsPaidToNonControllingInterestsFinCF,非支配株主への配当金の支払額、財務活動によるキャッシュ・フロー,Dividends paid to non-controlling interests,Dividends paid to non-controlling interests-FinCF
373,jppfs_cor:PaymentsFromChangesInOwnershipInterestsInSubsidiariesThatDoNotResultInChangeInScopeOfConsolidationFinCF,連結の範囲の変更を伴わない子会社株式の取得による支出、財務活動によるキャッシュ・フロー,Payments from changes in ownership interests in subsidiaries that do not result in change in scope of consolidation,Payments from changes in ownership interests in subsidiaries that do not result in change in scope of consolidation-FinCF
374,jppfs_cor:ProceedsFromChangesInOwnershipInterestsInSubsidiariesThatDoNotResultInChangeInScopeOfConsolidationFinCF,連結の範囲の変更を伴わない子会社株式の売却による収入、財務活動によるキャッシュ・フロー,Proceeds from changes in ownership interests in subsidiaries that do not result in change in scope of consolidation,Proceeds from changes in ownership interests in subsidiaries that do not result in change in scope of consolidation-FinCF
375,jppfs_cor:PaymentsAsFinancingActivitiesFinCFBNK,財務活動としての資金調達による支出、財務活動によるキャッシュ・フロー、銀行業,Payments as financing activities,Payments as financing activities-FinCF-BNK
376,jppfs_cor:RedemptionOfSubordinatedBondsFinCFBNK,劣後特約付社債の償還による支出、財務活動によるキャッシュ・フロー、銀行業,Redemption of subordinated bonds,Redemption of subordinated bonds-FinCF-BNK
377,jppfs_cor:IssuanceOfSubordinatedBondsFinCFBNK,劣後特約付社債の発行による収入、財務活動によるキャッシュ・フロー、銀行業,Issuance of subordinated bonds,Issuance of subordinated bonds-FinCF-BNK
378,jppfs_cor:IncreaseInSubordinatedBorrowingsFinCFBNK,劣後特約付借入れによる収入、財務活動によるキャッシュ・フロー、銀行業,Increase in subordinated borrowings,Increase in subordinated borrowings-FinCF-BNK
379,jppfs_cor:DecreaseInSubordinatedBorrowingsFinCFBNK,劣後特約付借入金の返済による支出、財務活動によるキャッシュ・フロー、銀行業,Decrease in subordinated borrowings,Decrease in subordinated borrowings-FinCF-BNK
380,jppfs_cor:ProceedsFromIssuanceOfSubordinatedBondsAndBondsWithSubscriptionRightsToSharesFinCFBNK,劣後特約付社債及び新株予約権付社債の発行による収入、財務活動によるキャッシュ・フロー、銀行業,Proceeds from issuance of subordinated bonds and bonds with share acquisition rights,Proceeds from issuance of subordinated bonds and bonds with share acquisition rights - FinCF - BNK
381,jppfs_cor:PaymentsForRedemptionSubordinatedBondsAndBondsWithSubscriptionRightsToSharesFinCFBNK,劣後特約付社債及び新株予約権付社債の償還による支出、財務活動によるキャッシュ・フロー、銀行業,Payments for redemption subordinated bonds and bonds with share acquisition rights,Payments for redemption subordinated bonds and bonds with share acquisition rights - FinCF - BNK
382,jppfs_cor:NetCashProvidedByUsedInFinancingActivities,財務活動によるキャッシュ・フロー,Net cash provided by (used in) financing activities,Net cash provided by (used in) financing activities
383,jppfs_cor:EffectOfExchangeRateChangeOnCashAndCashEquivalents,現金及び現金同等物に係る換算差額,Effect of exchange rate change on cash and cash equivalents,Effect of exchange rate change on cash and cash equivalents
384,jppfs_cor:NetIncreaseDecreaseInCashAndCashEquivalents,現金及び現金同等物の増減額（△は減少）,Net increase (decrease) in cash and cash equivalents,Net increase (decrease) in cash and cash equivalents
385,jppfs_cor:CashAndCashEquivalents,現金及び現金同等物の残高,Cash and cash equivalents,Cash and cash equivalents
