,タクソノミ,冗長ラベル（日本語）,標準ラベル（英語）,冗長ラベル（英語）
167,jppfs_cor:LiabilitiesAndNetAssets,負債純資産,Liabilities and net assets,Liabilities and net assets
168,nan,,,
169,nan,,,
170,名前空間プレフィックス:要素名,冗長ラベル（日本語）,標準ラベル（英語）,冗長ラベル（英語）
171,jppfs_cor:StatementOfIncomeAbstract,損益計算書 [タイトル項目],Statement of income,Statement of income [abstract]
172,jppfs_cor:StatementOfIncomeTable,損益計算書 [表],Statement of income,Statement of income [table]
173,jppfs_cor:StatementOfIncomeLineItems,損益計算書 [表示項目],Statement of income,Statement of income [line items]
174,jppfs_cor:OrdinaryIncomeBNK,経常収益、銀行業,Ordinary income,Ordinary income-BNK
175,jppfs_cor:InterestIncomeOIBNK,資金運用収益、経常収益、銀行業,Interest income,Interest income-OI-BNK
176,jppfs_cor:InterestOnLoansAndDiscountsOIBNK,貸出金利息、経常収益、銀行業,Interest on loans and discounts,Interest on loans and discounts-OI-BNK
177,jppfs_cor:InterestAndDividendsOnSecuritiesOIBNK,有価証券利息配当金、経常収益、銀行業,Interest and dividends on securities,Interest and dividends on securities-OI-BNK
178,jppfs_cor:InterestOnCallLoansAndBillsBoughtOIBNK,コールローン利息及び買入手形利息、経常収益、銀行業,Interest on call loans and bills bought,Interest on call loans and bills bought-OI-BNK
179,jppfs_cor:InterestOnCallLoansOIBNK,コールローン利息、経常収益、銀行業,Interest on call loans,Interest on call loans-OI-BNK
180,jppfs_cor:InterestOnBillsBoughtOIBNK,買入手形利息、経常収益、銀行業,Interest on bills bought,Interest on bills bought-OI-BNK
181,jppfs_cor:InterestOnReceivablesUnderResaleAgreementsOIBNK,買現先利息、経常収益、銀行業,Interest on receivables under resale agreements,Interest on receivables under resale agreements-OI-BNK
182,jppfs_cor:InterestOnReceivablesUnderSecuritiesBorrowingTransactionsOIBNK,債券貸借取引受入利息、経常収益、銀行業,Interest on receivables under securities borrowing transactions,Interest on receivables under securities borrowing transactions-OI-BNK
183,jppfs_cor:InterestOnDepositsWithBanksOIBNK,預け金利息、経常収益、銀行業,Interest on deposits with banks,Interest on deposits with banks-OI-BNK
184,jppfs_cor:InterestOnInterestSwapsOIBNK,金利スワップ受入利息、経常収益、銀行業,Interest on interest swaps,Interest on interest swaps-OI-BNK
185,jppfs_cor:OtherInterestIncomeOIBNK,その他の受入利息、経常収益、銀行業,Other interest income,Other interest income-OI-BNK
186,jppfs_cor:FeesAndCommissionsOIBNK,役務取引等収益、経常収益、銀行業,Fees and commissions,Fees and commissions-OI-BNK
187,jppfs_cor:FeesAndCommissionsOnDomesticAndForeignExchangesOIBNK,受入為替手数料、経常収益、銀行業,Fees and commissions on domestic and foreign exchanges,Fees and commissions on domestic and foreign exchanges-OI-BNK
188,jppfs_cor:OtherFeesAndCommissionsOIBNK,その他の役務収益、経常収益、銀行業,Other fees and commissions,Other fees and commissions-OI-BNK
189,jppfs_cor:TradingIncomeOIBNK,特定取引収益、経常収益、銀行業,Trading income,Trading income-OI-BNK
190,jppfs_cor:OtherOrdinaryIncomeOIBNK,その他業務収益、経常収益、銀行業,Other ordinary income,Other ordinary income-OI-BNK
191,jppfs_cor:GainsOnForeignExchangeTransactionsOIBNK,外国為替売買益、経常収益、銀行業,Gains on foreign exchange transactions,Gains on foreign exchange transactions-OI-BNK
192,jppfs_cor:GainOnTradingAccountSecuritiesTransactionsOIBNK,商品有価証券売買益、経常収益、銀行業,Gain on trading account securities transactions,Gain on trading account securities transactions-OI-BNK
193,jppfs_cor:GainsOnSalesOfBondsOIBNK,国債等債券売却益、経常収益、銀行業,Gains on sales of bonds,Gains on sales of bonds-OI-BNK
194,jppfs_cor:GainsOnRedemptionOfBondsOIBNK,国債等債券償還益、経常収益、銀行業,Gains on redemption of bonds,Gains on redemption of bonds-OI-BNK
195,jppfs_cor:IncomeFromDerivativesOtherThanForTradingOrHedgingOIBNK,金融派生商品収益、経常収益、銀行業,Income from derivatives other than for trading or hedging,Income from derivatives other than for trading or hedging-OI-BNK
196,jppfs_cor:OtherOtherOrdinaryIncomeOIBNK,その他の業務収益、経常収益、銀行業,Other,Other-other ordinary income-OI-BNK
197,jppfs_cor:OtherIncomeOIBNK,その他経常収益、経常収益、銀行業,Other income,Other income-OI-BNK
198,jppfs_cor:ReversalOfAllowanceForLoanLossesOIBNK,貸倒引当金戻入益、経常収益、銀行業,Reversal of allowance for loan losses,Reversal of allowance for loan losses-OI-BNK
199,jppfs_cor:RecoveriesOfWrittenOffClaimsOIBNK,償却債権取立益、経常収益、銀行業,Recoveries of written off claims,Recoveries of written off claims-OI-BNK
200,jppfs_cor:GainOnSalesOfStocksAndOtherSecuritiesOIBNK,株式等売却益、経常収益、銀行業,Gain on sales of stocks and other securities,Gain on sales of stocks and other securities-OI-BNK
201,jppfs_cor:GainOnMoneyHeldInTrustOIBNK,金銭の信託運用益、経常収益、銀行業,Gain on money held in trust,Gain on money held in trust-OI-BNK
202,jppfs_cor:OtherOtherIncomeOIBNK,その他の経常収益、経常収益、銀行業,Other,Other-other income-OI-BNK
203,jppfs_cor:TrustFeesBNK,信託報酬、銀行業,Trust fees,Trust fees-BNK
204,jppfs_cor:OrdinaryExpensesBNK,経常費用、銀行業,Ordinary expenses,Ordinary expenses-BNK
205,jppfs_cor:InterestExpensesOEBNK,資金調達費用、経常費用、銀行業,Interest expenses,Interest expenses-OE-BNK
206,jppfs_cor:InterestOnDepositsOEBNK,預金利息、経常費用、銀行業,Interest on deposits,Interest on deposits-OE-BNK
207,jppfs_cor:InterestOnNegotiableCertificatesOfDepositOEBNK,譲渡性預金利息、経常費用、銀行業,Interest on negotiable certificates of deposit,Interest on negotiable certificates of deposit-OE-BNK
208,jppfs_cor:InterestOnCallMoneyAndBillsSoldOEBNK,コールマネー利息及び売渡手形利息、経常費用、銀行業,Interest on call money and bills sold,Interest on call money and bills sold-OE-BNK
209,jppfs_cor:InterestOnCallMoneyOEBNK,コールマネー利息、経常費用、銀行業,Interest on call money,Interest on call money-OE-BNK
210,jppfs_cor:InterestOnBillsSoldOEBNK,売渡手形利息、経常費用、銀行業,Interest on bills sold,Interest on bills sold-OE-BNK
211,jppfs_cor:InterestOnPayablesUnderRepurchaseAgreementsOEBNK,売現先利息、経常費用、銀行業,Interest on payables under repurchase agreements,Interest on payables under repurchase agreements-OE-BNK
212,jppfs_cor:InterestOnPayablesUnderSecuritiesLendingTransactionsOEBNK,債券貸借取引支払利息、経常費用、銀行業,Interest on payables under securities lending transactions,Interest on payables under securities lending transactions-OE-BNK
213,jppfs_cor:InterestOnCommercialPapersNOE,コマーシャル・ペーパー利息、営業外費用,Interest on commercial papers,Interest on commercial papers-NOE
214,jppfs_cor:InterestOnBorrowingsAndRediscountsOEBNK,借用金利息、経常費用、銀行業,Interest on borrowings and rediscounts,Interest on borrowings and rediscounts-OE-BNK
215,jppfs_cor:InterestOnShortTermBondsNOE,短期社債利息、営業外費用,Interest on short-term bonds,Interest on short-term bonds-NOE
216,jppfs_cor:InterestOnBondsNOE,社債利息、営業外費用,Interest on bonds,Interest on bonds-NOE
217,jppfs_cor:InterestOnBondsWithSubscriptionRightsToSharesOEBNK,新株予約権付社債利息、経常費用、銀行業,Interest on bonds with share acquisition rights,Interest on bonds with share acquisition rights - OE - BNK
218,jppfs_cor:InterestOnInterestSwapsOEBNK,金利スワップ支払利息、経常費用、銀行業,Interest on interest swaps,Interest on interest swaps-OE-BNK
219,jppfs_cor:InterestOnDebenturesBNK,債券利息、銀行業,Interest on debentures,Interest on debentures-BNK
220,jppfs_cor:OtherInterestExpensesOEBNK,その他の支払利息、経常費用、銀行業,Other interest expenses,Other interest expenses-OE-BNK
221,jppfs_cor:FeesAndCommissionsPaymentsOEBNK,役務取引等費用、経常費用、銀行業,Fees and commissions payments,Fees and commissions payments-OE-BNK
222,jppfs_cor:FeesAndCommissionsOnDomesticAndForeignExchangesOEBNK,支払為替手数料、経常費用、銀行業,Fees and commissions on domestic and foreign exchanges,Fees and commissions on domestic and foreign exchanges-OE-BNK
223,jppfs_cor:OtherFeesAndCommissionsOEBNK,その他の役務費用、経常費用、銀行業,Other fees and commissions,Other fees and commissions-OE-BNK
224,jppfs_cor:TradingExpensesOEBNK,特定取引費用、経常費用、銀行業,Trading expenses,Trading expenses-OE-BNK
225,jppfs_cor:OtherOrdinaryExpensesOEBNK,その他業務費用、経常費用、銀行業,Other ordinary expenses,Other ordinary expenses-OE-BNK
226,jppfs_cor:LossOnForeignExchangeTransactionsOEBNK,外国為替売買損、経常費用、銀行業,Loss on foreign exchange transactions,Loss on foreign exchange transactions-OE-BNK
227,jppfs_cor:LossOnTradingAccountSecuritiesTransactionsOEBNK,商品有価証券売買損、経常費用、銀行業,Loss on trading account securities transactions,Loss on trading account securities transactions-OE-BNK
228,jppfs_cor:LossOnSalesOfBondsOEBNK,国債等債券売却損、経常費用、銀行業,Loss on sales of bonds,Loss on sales of bonds-OE-BNK
229,jppfs_cor:LossOnRedemptionOfBondsOEBNK,国債等債券償還損、経常費用、銀行業,Loss on redemption of bonds,Loss on redemption of bonds-OE-BNK
230,jppfs_cor:LossOnDevaluationOfBondsOEBNK,国債等債券償却、経常費用、銀行業,Loss on devaluation of bonds,Loss on devaluation of bonds-OE-BNK
231,jppfs_cor:AmortizationOfBondIssuanceCostNOE,社債発行費償却、営業外費用,Amortization of bond issuance cost,Amortization of bond issuance cost-NOE
232,jppfs_cor:ExpensesOnDerivativesOtherThanForTradingOrHedgingOEBNK,金融派生商品費用、経常費用、銀行業,Expenses on derivatives other than for trading or hedging,Expenses on derivatives other than for trading or hedging-OE-BNK
233,jppfs_cor:AmortizationOfDebentureIssuanceCostOEBNK,債券発行費用償却、経常費用、銀行業,Amortization of debenture issuance cost,Amortization of debenture issuance cost-OE-BNK
234,jppfs_cor:AmortizationOfOtherAssetsBNK,その他資産償却、銀行業,Amortization of other assets,Amortization of other assets-BNK
235,jppfs_cor:OtherOtherOperatingExpensesOEBNK,その他の業務費用、経常費用、銀行業,Other,Other-other operating expenses-OE-BNK
236,jppfs_cor:GeneralAndAdministrativeExpensesOEBNK,営業経費、経常費用、銀行業,General and administrative expenses,General and administrative expenses-OE-BNK
237,jppfs_cor:OtherExpensesOEBNK,その他経常費用、経常費用、銀行業,Other expenses,Other expenses-OE-BNK
238,jppfs_cor:ProvisionOfAllowanceForLoanLossesOEBNK,貸倒引当金繰入額、経常費用、銀行業,Provision of allowance for loan losses,Provision of allowance for loan losses-OE-BNK
239,jppfs_cor:WrittenOffOfLoansOEBNK,貸出金償却、経常費用、銀行業,Written-off of loans,Written-off of loans-OE-BNK
240,jppfs_cor:LossesOnSalesOfStocksAndOtherSecuritiesOEBNK,株式等売却損、経常費用、銀行業,Losses on sales of stocks and other securities,Losses on sales of stocks and other securities-OE-BNK
241,jppfs_cor:LossesOnDevaluationOfStocksAndOtherSecuritiesOEBNK,株式等償却、経常費用、銀行業,Losses on devaluation of stocks and other securities,Losses on devaluation of stocks and other securities-OE-BNK
242,jppfs_cor:LossOnMoneyHeldInTrustOEBNK,金銭の信託運用損、経常費用、銀行業,Loss on money held in trust,Loss on money held in trust-OE-BNK
243,jppfs_cor:ProvisionOfAllowanceForInvestmentLossOEBNK,投資損失引当金繰入額、経常費用、銀行業,Provision of allowance for investment loss,Provision of allowance for investment loss-OE-BNK
244,jppfs_cor:OtherOtherExpensesOEBNK,その他の経常費用、経常費用、銀行業,Other,Other-other expenses-OE-BNK
245,jppfs_cor:OrdinaryIncome,経常利益又は経常損失（△）,Ordinary profit (loss),Ordinary profit (loss)
246,jppfs_cor:ExtraordinaryIncome,特別利益,Extraordinary income,Extraordinary income
247,jppfs_cor:GainOnDisposalOfNoncurrentAssetsEI,固定資産処分益、特別利益,Gain on disposal of non-current assets,Gain on disposal of non-current assets-EI
248,jppfs_cor:GainOnNegativeGoodwillEI,負ののれん発生益、特別利益,Gain on bargain purchase,Gain on bargain purchase-EI
249,jppfs_cor:TransferFromReserveForFinancialProductsTransactionLiabilitiesEIBNK,金融商品取引責任準備金取崩額、特別利益、銀行業,Transfer from reserve for financial products transaction liabilities,Transfer from reserve for financial products transaction liabilities-EI-BNK
250,jppfs_cor:ReversalOfAllowanceForInvestmentLossEIBNK,投資損失引当金戻入益、特別利益、銀行業,Reversal of allowance for investment loss,Reversal of allowance for investment loss-EI-BNK
251,jppfs_cor:OtherEI,その他、特別利益,Other,Other-EI
252,jppfs_cor:ExtraordinaryLoss,特別損失,Extraordinary losses,Extraordinary losses
253,jppfs_cor:LossOnDisposalOfNoncurrentAssetsEL,固定資産処分損、特別損失,Loss on disposal of non-current assets,Loss on disposal of non-current assets-EL
254,jppfs_cor:ImpairmentLossEL,減損損失、特別損失,Impairment loss,Impairment loss-EL
255,jppfs_cor:TransferToReserveForFinancialProductsTransactionLiabilitiesELBNK,金融商品取引責任準備金繰入額、特別損失、銀行業,Transfer to reserve for financial products transaction liabilities,Transfer to reserve for financial products transaction liabilities-EL-BNK
256,jppfs_cor:OtherEL,その他、特別損失,Other,Other-EL
257,jppfs_cor:IncomeBeforeIncomeTaxes,税引前当期純利益又は税引前当期純損失（△）,Profit (loss) before income taxes,Profit (loss) before income taxes
258,jppfs_cor:IncomeTaxes,法人税等,Income taxes,Income taxes
259,jppfs_cor:IncomeTaxesCurrent,法人税、住民税及び事業税,Income taxes - current,Income taxes-current
260,jppfs_cor:IncomeTaxesDeferred,法人税等調整額,Income taxes - deferred,Income taxes-deferred
261,jppfs_cor:ProfitLoss,当期純利益又は当期純損失（△）（平成26年3月28日財規等改正後）,Profit (loss),Profit (loss) (after amendment dated 2014-03-28)
262,jppfs_cor:ProfitLossAttributableToNonControllingInterests,非支配株主に帰属する当期純利益又は非支配株主に帰属する当期純損失（△）,Profit (loss) attributable to non-controlling interests,Profit (loss) attributable to non-controlling interests
263,jppfs_cor:ProfitLossAttributableToOwnersOfParent,親会社株主に帰属する当期純利益又は親会社株主に帰属する当期純損失（△）,Profit (loss) attributable to owners of parent,Profit (loss) attributable to owners of parent
264,nan,,,
265,nan,,,
266,名前空間プレフィックス:要素名,冗長ラベル（日本語）,標準ラベル（英語）,冗長ラベル（英語）
267,jppfs_cor:StatementOfChangesInEquityAbstract,株主資本等変動計算書 [タイトル項目],Statement of changes in equity,Statement of changes in equity [abstract]
268,jppfs_cor:StatementOfChangesInEquityTable,株主資本等変動計算書 [表],Statement of changes in equity,Statement of changes in equity [table]
269,jppfs_cor:ComponentsOfEquityAxis,純資産の内訳項目 [軸],Components of equity,Components of equity [axis]
270,jppfs_cor:NetAssetsMember,純資産 [メンバー],Net assets,Net assets [member]
271,jppfs_cor:ShareholdersEquityMember,株主資本 [メンバー],Shareholders' equity,Shareholders' equity [member]
272,jppfs_cor:CapitalStockMember,資本金 [メンバー],Capital stock,Capital stock [member]
273,jppfs_cor:CapitalSurplusMember,資本剰余金 [メンバー],Capital surplus,Capital surplus [member]
274,jppfs_cor:LegalCapitalSurplusMember,資本準備金 [メンバー],Legal capital surplus,Legal capital surplus [member]
275,jppfs_cor:OtherCapitalSurplusMember,その他資本剰余金 [メンバー],Other capital surplus,Other capital surplus [member]
276,jppfs_cor:RetainedEarningsMember,利益剰余金 [メンバー],Retained earnings,Retained earnings [member]
277,jppfs_cor:LegalRetainedEarningsMember,利益準備金 [メンバー],Legal retained earnings,Legal retained earnings [member]
278,jppfs_cor:OtherRetainedEarningsMember,その他利益剰余金 [メンバー],Other retained earnings,Other retained earnings [member]
279,jppfs_cor:RetainedEarningsBroughtForwardMember,繰越利益剰余金 [メンバー],Retained earnings brought forward,Retained earnings brought forward [member]
280,jppfs_cor:TreasuryStockMember,自己株式 [メンバー],Treasury shares,Treasury shares [member]
281,jppfs_cor:ValuationAndTranslationAdjustmentsMember,評価・換算差額等 [メンバー],Valuation and translation adjustments,Valuation and translation adjustments [member]
282,jppfs_cor:ValuationDifferenceOnAvailableForSaleSecuritiesMember,その他有価証券評価差額金 [メンバー],Valuation difference on available-for-sale securities,Valuation difference on available-for-sale securities [member]
283,jppfs_cor:DeferredGainsOrLossesOnHedgesMember,繰延ヘッジ損益 [メンバー],Deferred gains or losses on hedges,Deferred gains or losses on hedges [member]
284,jppfs_cor:RevaluationReserveForLandMember,土地再評価差額金 [メンバー],Revaluation reserve for land,Revaluation reserve for land [member]
285,jppfs_cor:ForeignCurrencyTranslationAdjustmentMember,為替換算調整勘定 [メンバー],Foreign currency translation adjustment,Foreign currency translation adjustment [member]
286,jppfs_cor:SubscriptionRightsToSharesMember,新株予約権 [メンバー],Share acquisition rights,Share acquisition rights [member]
287,jppfs_cor:NonControllingInterestsMember,非支配株主持分 [メンバー],Non-controlling interests,Non-controlling interests [member]
288,jppfs_cor:StatementOfChangesInEquityLineItems,株主資本等変動計算書 [表示項目],Statement of changes in equity,Statement of changes in equity [line items]
289,jppfs_cor:NetAssets,純資産,Net assets,Net assets
290,jppfs_cor:ChangesOfItemsDuringThePeriodAbstract,当期変動額 [タイトル項目],Changes of items during period,Changes of items during period [abstract]
291,jppfs_cor:IssuanceOfNewShares,新株の発行,Issuance of new shares,Issuance of new shares
292,jppfs_cor:DividendsFromSurplus,剰余金の配当,Dividends of surplus,Dividends of surplus
293,jppfs_cor:ProfitLossAttributableToOwnersOfParent,親会社株主に帰属する当期純利益又は親会社株主に帰属する当期純損失（△）,Profit (loss) attributable to owners of parent,Profit (loss) attributable to owners of parent
294,jppfs_cor:ProfitLoss,当期純利益又は当期純損失（△）（平成26年3月28日財規等改正後）,Profit (loss),Profit (loss) (after amendment dated 2014-03-28)
295,jppfs_cor:DisposalOfTreasuryStock,自己株式の処分,Disposal of treasury shares,Disposal of treasury shares
296,jppfs_cor:NetChangesOfItemsOtherThanShareholdersEquity,株主資本以外の項目の当期変動額（純額）,Net changes of items other than shareholders' equity,Net changes of items other than shareholders' equity
297,jppfs_cor:TotalChangesOfItemsDuringThePeriod,当期変動額合計,Total changes of items during period,Total changes of items during period
298,nan,,,
299,nan,,,
300,名前空間プレフィックス:要素名,冗長ラベル（日本語）,標準ラベル（英語）,冗長ラベル（英語）
301,jppfs_cor:StatementOfCashFlowsAbstract,キャッシュ・フロー計算書 [タイトル項目],Statement of cash flows,Statement of cash flows [abstract]
302,jppfs_cor:StatementOfCashFlowsTable,キャッシュ・フロー計算書 [表],Statement of cash flows,Statement of cash flows [table]
303,jppfs_cor:StatementOfCashFlowsLineItems,キャッシュ・フロー計算書 [表示項目],Statement of cash flows,Statement of cash flows [line items]
304,jppfs_cor:NetCashProvidedByUsedInOperatingActivitiesAbstract,営業活動によるキャッシュ・フロー [タイトル項目],Cash flows from operating activities,Cash flows from operating activities [abstract]
305,jppfs_cor:SubtotalOpeCF,小計、営業活動によるキャッシュ・フロー,Subtotal,Subtotal-OpeCF
306,jppfs_cor:CollectionOfLoansReceivableOpeCFBNK,貸付金回収による収入、営業活動によるキャッシュ・フロー、銀行業,Collection of loans receivable,Collection of loans receivable-OpeCF-BNK
307,jppfs_cor:PaymentsForWithdrawalOfDepositsOpeCFBNK,預金払出による支出、営業活動によるキャッシュ・フロー、銀行業,Payments for withdrawal of deposits,Payments for withdrawal of deposits-OpeCF-BNK
308,jppfs_cor:ProceedsFromInterestOnLoansOpeCFBNK,貸付金利息収入、営業活動によるキャッシュ・フロー、銀行業,Proceeds from interest on loans,Proceeds from interest on loans-OpeCF-BNK
309,jppfs_cor:PaymentsForInterestExpensesForDepositOpeCFBNK,預金利息支出、営業活動によるキャッシュ・フロー、銀行業,Payments for interest expenses for deposit,Payments for interest expenses for deposit-OpeCF-BNK
310,jppfs_cor:PaymentsForOrdinaryExpensesOpeCFBNK,営業経費支出、営業活動によるキャッシュ・フロー、銀行業,Payments for ordinary expenses,Payments for ordinary expenses-OpeCF-BNK
311,jppfs_cor:IncomeBeforeIncomeTaxes,税引前当期純利益又は税引前当期純損失（△）,Profit (loss) before income taxes,Profit (loss) before income taxes
312,jppfs_cor:DepreciationAndAmortizationOpeCF,減価償却費、営業活動によるキャッシュ・フロー,Depreciation,Depreciation-OpeCF
313,jppfs_cor:ImpairmentLossOpeCF,減損損失、営業活動によるキャッシュ・フロー,Impairment loss,Impairment loss-OpeCF
314,jppfs_cor:IncreaseDecreaseInAllowanceForLoanLossesOpeCFBNK,貸倒引当金の増減（△）、営業活動によるキャッシュ・フロー、銀行業,Increase (decrease) in allowance for loan losses,Increase (decrease) in allowance for loan losses-OpeCF-BNK
315,jppfs_cor:GainOnFundManagementOpeCFBNK,資金運用収益、営業活動によるキャッシュ・フロー、銀行業,Gain on fund management,Gain on fund management-OpeCF-BNK
316,jppfs_cor:FinancingExpensesOpeCFBNK,資金調達費用、営業活動によるキャッシュ・フロー、銀行業,Financing expenses,Financing expenses-OpeCF-BNK
317,jppfs_cor:LossGainRelatedToSecuritiesOpeCFBNK,有価証券関係損益（△）、営業活動によるキャッシュ・フロー、銀行業,Loss (gain) related to securities,Loss (gain) related to securities-OpeCF-BNK
318,jppfs_cor:NetDecreaseIncreaseInLoansAndBillsDiscountedOpeCFBNK,貸出金の純増（△）減、営業活動によるキャッシュ・フロー、銀行業,Net decrease (increase) in loans and bills discounted,Net decrease (increase) in loans and bills discounted-OpeCF-BNK
319,jppfs_cor:NetIncreaseDecreaseInDepositOpeCFBNK,預金の純増減（△）、営業活動によるキャッシュ・フロー、銀行業,Net increase (decrease) in deposit,Net increase (decrease) in deposit-OpeCF-BNK
320,jppfs_cor:IncreaseDecreaseInProvisionForReimbursementOfDepositsOpeCFBNK,睡眠預金払戻損失引当金の増減（△）、営業活動によるキャッシュ・フロー、銀行業,Increase (decrease) in provision for reimbursement of deposits,Increase (decrease) in provision for reimbursement of deposits-OpeCF-BNK
321,jppfs_cor:ProceedsFromFundManagementOpeCFBNK,資金運用による収入、営業活動によるキャッシュ・フロー、銀行業,Proceeds from fund management,Proceeds from fund management-OpeCF-BNK
322,jppfs_cor:PaymentsForFinanceOpeCFBNK,資金調達による支出、営業活動によるキャッシュ・フロー、銀行業,Payments for finance,Payments for finance-OpeCF-BNK
323,jppfs_cor:NetDecreaseIncreaseInTradingAccountSecuritiesOpeCFBNK,商品有価証券の純増（△）減、営業活動によるキャッシュ・フロー、銀行業,Net decrease (increase) in trading account securities,Net decrease (increase) in trading account securities-OpeCF-BNK
324,jppfs_cor:NetIncreaseDecreaseInCommercialPapersOpeCFBNK,コマーシャル・ペーパーの純増減（△）、営業活動によるキャッシュ・フロー、銀行業,Net increase (decrease) in commercial papers,Net increase (decrease) in commercial papers-OpeCF-BNK
325,jppfs_cor:NetIncreaseDecreaseInCallMoneyOpeCFBNK,コールマネー等の純増減（△）、営業活動によるキャッシュ・フロー、銀行業,Net increase (decrease) in call money,Net increase (decrease) in call money-OpeCF-BNK
326,jppfs_cor:NetDecreaseIncreaseInCallLoansOpeCFBNK,コールローン等の純増（△）減、営業活動によるキャッシュ・フロー、銀行業,Net decrease (increase) in call loans,Net decrease (increase) in call loans-OpeCF-BNK
327,jppfs_cor:NetDecreaseIncreaseInForeignExchangesAssetsOpeCFBNK,外国為替（資産）の純増（△）減、営業活動によるキャッシュ・フロー、銀行業,Net decrease (increase) in foreign exchanges - assets,Net decrease (increase) in foreign exchanges-assets-OpeCF-BNK
