タクソノミ,冗長ラベル（日本語）,標準ラベル（英語）,冗長ラベル（英語）
jppfs_cor:BalanceSheetAbstract,貸借対照表 [タイトル項目],Balance sheet,Balance sheet [abstract]
jppfs_cor:BalanceSheetTable,貸借対照表 [表],Balance sheet,Balance sheet [table]
jppfs_cor:BalanceSheetLineItems,貸借対照表 [表示項目],Balance sheet,Balance sheet [line items]
jppfs_cor:AssetsAbstract,資産の部 [タイトル項目],Assets,Assets [abstract]
jppfs_cor:NoncurrentAssetsAbstract,固定資産 [タイトル項目],Non-current assets,Non-current assets [abstract]
jppfs_cor:PropertyPlantAndEquipmentAbstract,有形固定資産 [タイトル項目],"Property, plant and equipment","Property, plant and equipment [abstract]"
jppfs_cor:Land,土地,Land,Land
jppfs_cor:Buildings,建物,Buildings,Buildings
jppfs_cor:AccumulatedDepreciationBuildings,減価償却累計額、建物,Accumulated depreciation,Accumulated depreciation-buildings
jppfs_cor:AccumulatedImpairmentLossBuildings,減損損失累計額、建物,Accumulated impairment loss,Accumulated impairment loss-buildings
jppfs_cor:AccumulatedDepreciationAndImpairmentLossBuildings,減価償却累計額及び減損損失累計額、建物,Accumulated depreciation and impairment loss,Accumulated depreciation and impairment loss-buildings
jppfs_cor:BuildingsNet,建物（純額）,"Buildings, net","Buildings, net"
jppfs_cor:Structures,構築物,Structures,Structures
jppfs_cor:AccumulatedDepreciationStructures,減価償却累計額、構築物,Accumulated depreciation,Accumulated depreciation-structures
jppfs_cor:AccumulatedImpairmentLossStructures,減損損失累計額、構築物,Accumulated impairment loss,Accumulated impairment loss-structures
jppfs_cor:AccumulatedDepreciationAndImpairmentLossStructures,減価償却累計額及び減損損失累計額、構築物,Accumulated depreciation and impairment loss,Accumulated depreciation and impairment loss-structures
jppfs_cor:StructuresNet,構築物（純額）,"Structures, net","Structures, net"
jppfs_cor:EducationalResearchInstrumentAndEquipmentEDU,教育研究用機器備品、学校法人,Educational research instrument and equipment,Educational research instrument and equipment-EDU
jppfs_cor:AccumulatedDepreciationEducationalResearchInstrumentAndEquipmentEDU,減価償却累計額、教育研究用機器備品、学校法人,Accumulated depreciation,Accumulated depreciation-educational research instrument and equipment-EDU
jppfs_cor:AccumulatedImpairmentLossEducationalResearchInstrumentAndEquipmentEDU,減損損失累計額、教育研究用機器備品、学校法人,Accumulated impairment loss,Accumulated impairment loss-educational research instrument and equipment-EDU
jppfs_cor:AccumulatedDepreciationAndImpairmentLossEducationalResearchInstrumentAndEquipmentEDU,減価償却累計額及び減損損失累計額、教育研究用機器備品、学校法人,Accumulated depreciation and impairment loss,Accumulated depreciation and impairment loss-educational research instrument and equipment-EDU
jppfs_cor:EducationalResearchInstrumentAndEquipmentNetEDU,教育研究用機器備品（純額）、学校法人,"Educational research instrument and equipment, net","Educational research instrument and equipment, net-EDU"
jppfs_cor:OtherInstrumentAndEquipmentEDU,その他の機器備品、学校法人,Other instrument and equipment,Other instrument and equipment-EDU
jppfs_cor:AccumulatedDepreciationOtherInstrumentAndEquipmentEDU,減価償却累計額、その他の機器備品、学校法人,Accumulated depreciation,Accumulated depreciation-other instrument and equipment-EDU
jppfs_cor:AccumulatedImpairmentLossOtherInstrumentAndEquipmentEDU,減損損失累計額、その他の機器備品、学校法人,Accumulated impairment loss,Accumulated impairment loss-other instrument and equipment-EDU
jppfs_cor:AccumulatedDepreciationAndImpairmentLossOtherInstrumentAndEquipmentEDU,減価償却累計額及び減損損失累計額、その他の機器備品、学校法人,Accumulated depreciation and impairment loss,Accumulated depreciation and impairment loss-other instrument and equipment-EDU
jppfs_cor:OtherInstrumentAndEquipmentNetEDU,その他の機器備品（純額）、学校法人,"Other instrument and equipment, net","Other instrument and equipment, net-EDU"
jppfs_cor:VesselsAndVehiclesEDU,船舶及び車両、学校法人,Vessels and vehicles,Vessels and vehicles-EDU
jppfs_cor:AccumulatedDepreciationVesselsAndVehiclesEDU,減価償却累計額、船舶及び車両、学校法人,Accumulated depreciation,Accumulated depreciation-vessels and vehicles-EDU
jppfs_cor:AccumulatedImpairmentLossVesselsAndVehiclesEDU,減損損失累計額、船舶及び車両、学校法人,Accumulated impairment loss,Accumulated impairment loss-vessels and vehicles-EDU
jppfs_cor:AccumulatedDepreciationAndImpairmentLossVesselsAndVehiclesEDU,減価償却累計額及び減損損失累計額、船舶及び車両、学校法人,Accumulated depreciation and impairment loss,Accumulated depreciation and impairment loss-vessels and vehicles-EDU
jppfs_cor:VesselsAndVehiclesNetEDU,船舶及び車両（純額）、学校法人,"Vessels and vehicles, net","Vessels and vehicles, net-EDU"
jppfs_cor:LeaseAssetsPPE,リース資産、有形固定資産,Leased assets,Leased assets-PPE
jppfs_cor:AccumulatedDepreciationLeaseAssetsPPE,減価償却累計額、リース資産、有形固定資産,Accumulated depreciation,Accumulated depreciation-lease assets-PPE
jppfs_cor:AccumulatedImpairmentLossLeaseAssetsPPE,減損損失累計額、リース資産、有形固定資産,Accumulated impairment loss,Accumulated impairment loss-lease assets-PPE
jppfs_cor:AccumulatedDepreciationAndImpairmentLossLeaseAssetsPPE,減価償却累計額及び減損損失累計額、リース資産、有形固定資産,Accumulated depreciation and impairment loss,Accumulated depreciation and impairment loss-lease assets-PPE
jppfs_cor:LeaseAssetsNetPPE,リース資産（純額）、有形固定資産,"Leased assets, net","Leased assets, net-PPE"
jppfs_cor:BooksEDU,図書、学校法人,Books,Books-EDU
jppfs_cor:ConstructionInProgress,建設仮勘定,Construction in progress,Construction in progress
jppfs_cor:OtherNetPPE,その他（純額）、有形固定資産,"Other, net","Other, net-PPE"
jppfs_cor:AccumulatedDepreciationPPEByGroup,減価償却累計額、有形固定資産、一括控除,Accumulated depreciation,Accumulated depreciation-PPE-by group
jppfs_cor:AccumulatedImpairmentLossPPEByGroup,減損損失累計額、有形固定資産、一括控除,Accumulated impairment loss,Accumulated impairment loss-PPE-by group
jppfs_cor:AccumulatedDepreciationAndImpairmentLossPPEByGroup,減価償却累計額及び減損損失累計額、有形固定資産、一括控除,Accumulated depreciation and impairment loss,Accumulated depreciation and impairment loss-PPE-by group
jppfs_cor:PropertyPlantAndEquipment,有形固定資産,"Property, plant and equipment","Property, plant and equipment"
jppfs_cor:IntangibleAssetsAbstract,無形固定資産 [タイトル項目],Intangible assets,Intangible assets [abstract]
jppfs_cor:LeaseholdRight,借地権,Leasehold right,Leasehold right
jppfs_cor:PatentRight,特許権,Patent right,Patent right
jppfs_cor:Software,ソフトウエア,Software,Software
jppfs_cor:LeaseAssetsIA,リース資産、無形固定資産,Leased assets,Leased assets-IA
jppfs_cor:OtherIA,その他、無形固定資産,Other,Other-IA
jppfs_cor:IntangibleAssets,無形固定資産,Intangible assets,Intangible assets
jppfs_cor:InvestmentsAndOtherAssetsAbstract,投資その他の資産 [タイトル項目],Investments and other assets,Investments and other assets [abstract]
jppfs_cor:InvestmentSecurities,投資有価証券,Investment securities,Investment securities
jppfs_cor:StocksOfSubsidiariesAndAffiliates,関係会社株式,Shares of subsidiaries and associates,Shares of subsidiaries and associates
jppfs_cor:BondsOfSubsidiariesAndAffiliates,関係会社社債,Bonds of subsidiaries and associates,Bonds of subsidiaries and associates
jppfs_cor:InvestmentsInOtherSecuritiesOfSubsidiariesAndAffiliates,その他の関係会社有価証券,Investments in other securities of subsidiaries and associates,Investments in other securities of subsidiaries and associates
jppfs_cor:InvestmentsInCapital,出資金,Investments in capital,Investments in capital
jppfs_cor:InvestmentsInCapitalOfSubsidiariesAndAffiliates,関係会社出資金,Investments in capital of subsidiaries and associates,Investments in capital of subsidiaries and associates
jppfs_cor:ReservedAssetsForDepreciationEDU,減価償却引当特定資産、学校法人,Reserved assets for depreciation,Reserved assets for depreciation-EDU
jppfs_cor:LongTermLoansReceivable,長期貸付金,Long-term loans receivable,Long-term loans receivable
jppfs_cor:AllowanceForDoubtfulAccountsLongTermLoansReceivable,貸倒引当金、長期貸付金,Allowance for doubtful accounts,Allowance for doubtful accounts-long-term loans receivable
jppfs_cor:LongTermLoansReceivableNet,長期貸付金（純額）,"Long-term loans receivable, net","Long-term loans receivable, net"
jppfs_cor:LongTermLoansReceivableFromDirectorsAndOtherEDU,役員等長期貸付金、学校法人,Long-term loans receivable from directors and other,Long-term loans receivable from directors and other-EDU
jppfs_cor:AllowanceForDoubtfulAccountsLongTermLoansReceivableFromDirectorsAndOtherEDU,貸倒引当金、役員等長期貸付金、学校法人,Allowance for doubtful accounts,Allowance for doubtful accounts-long-term loans receivable from directors and other-EDU
jppfs_cor:LongTermLoansReceivableFromDirectorsAndOtherNetEDU,役員等長期貸付金（純額）、学校法人,"Long-term loans receivable from directors and other, net","Long-term loans receivable from directors and other, net-EDU"
jppfs_cor:LongTermLoansReceivableFromSubsidiariesAndAffiliates,関係会社長期貸付金,Long-term loans receivable from subsidiaries and associates,Long-term loans receivable from subsidiaries and associates
jppfs_cor:AllowanceForDoubtfulAccountsLongTermLoansReceivableFromSubsidiariesAndAffiliates,貸倒引当金、関係会社長期貸付金,Allowance for doubtful accounts,Allowance for doubtful accounts-long-term loans receivable from subsidiaries and affiliates
jppfs_cor:LongTermLoansReceivableFromSubsidiariesAndAffiliatesNet,関係会社長期貸付金（純額）,"Long-term loans receivable from subsidiaries and associates, net","Long-term loans receivable from subsidiaries and associates, net"
jppfs_cor:ClaimsProvableInBankruptcyClaimsProvableInRehabilitationAndOther,破産更生債権等,"Claims provable in bankruptcy, claims provable in rehabilitation and other","Claims provable in bankruptcy, claims provable in rehabilitation and other"
jppfs_cor:AllowanceForDoubtfulAccountsClaimsInBankruptcyReorganizationClaimsAndOther,貸倒引当金、破産更生債権等,Allowance for doubtful accounts,"Allowance for doubtful accounts-claims provable in bankruptcy, claims provable in rehabilitation and other"
jppfs_cor:ClaimsProvableInBankruptcyClaimsProvableInRehabilitationAndOtherNet,破産更生債権等（純額）,"Claims provable in bankruptcy, claims provable in rehabilitation and other, net","Claims provable in bankruptcy, claims provable in rehabilitation and other, net"
jppfs_cor:LongTermPrepaidExpenses,長期前払費用,Long-term prepaid expenses,Long-term prepaid expenses
jppfs_cor:DeferredTaxAssetsIOA,繰延税金資産、投資その他の資産,Deferred tax assets,Deferred tax assets-IOA
jppfs_cor:RealEstateForInvestmentNet,投資不動産（純額）,"Real estate for investment, net","Real estate for investment, net"
jppfs_cor:OtherNCAEDU,その他、固定資産、学校法人,Other,Other-NCA-EDU
jppfs_cor:AllowanceForDoubtfulAccountsIOAByGroup,貸倒引当金、投資その他の資産、一括控除,Allowance for doubtful accounts,Allowance for doubtful accounts-IOA-by group
jppfs_cor:InvestmentsAndOtherAssets,投資その他の資産,Investments and other assets,Investments and other assets
jppfs_cor:NoncurrentAssets,固定資産,Non-current assets,Non-current assets
jppfs_cor:DeferredAssetsAbstract,繰延資産 [タイトル項目],Deferred assets,Deferred assets [abstract]
jppfs_cor:SchoolBondIssuanceCostEDU,学校債発行費、学校法人,School bond issuance cost,School bond issuance cost-EDU
jppfs_cor:SchoolEstablishmentExpensesEDU,開設費、学校法人,School establishment expenses,School establishment expenses-EDU
jppfs_cor:DeferredAssets,繰延資産,Deferred assets,Deferred assets
jppfs_cor:CurrentAssetsAbstract,流動資産 [タイトル項目],Current assets,Current assets [abstract]
jppfs_cor:CashAndDeposits,現金及び預金,Cash and deposits,Cash and deposits
jppfs_cor:AccountsReceivableEDU,未収入金、学校法人,Accounts receivable,Accounts receivable-EDU
jppfs_cor:AllowanceForDoubtfulAccountsAccountsReceivableEDU,貸倒引当金、未収入金、学校法人,Allowance for doubtful accounts,Allowance for doubtful accounts-accounts receivable-EDU
jppfs_cor:AccountsReceivableNetEDU,未収入金（純額）、学校法人,"Accounts receivable, net","Accounts receivable, net-EDU"
jppfs_cor:LeaseReceivablesCA,リース債権、流動資産,Lease receivables,Lease receivables-CA
jppfs_cor:AllowanceForDoubtfulAccountsLeaseReceivablesCA,貸倒引当金、リース債権、流動資産,Allowance for doubtful accounts,Allowance for doubtful accounts-lease receivables-CA
jppfs_cor:LeaseReceivablesNetCA,リース債権（純額）、流動資産,"Lease receivables, net","Lease receivables, net-CA"
jppfs_cor:LeaseInvestmentAssetsCA,リース投資資産、流動資産,Lease investment assets,Lease investment assets-CA
jppfs_cor:AllowanceForDoubtfulAccountsLeaseInvestmentAssetsCA,貸倒引当金、リース投資資産、流動資産,Allowance for doubtful accounts,Allowance for doubtful accounts-lease investment assets-CA
jppfs_cor:LeaseInvestmentAssetsNetCA,リース投資資産（純額）、流動資産,"Lease investment assets, net","Lease investment assets, net-CA"
jppfs_cor:ShortTermInvestmentSecurities,有価証券,Securities,Securities
jppfs_cor:Inventories,たな卸資産,Inventories,Inventories
jppfs_cor:ShortTermLoansReceivable,短期貸付金,Short-term loans receivable,Short-term loans receivable
jppfs_cor:AllowanceForDoubtfulAccountsShortTermLoans,貸倒引当金、短期貸付金,Allowance for doubtful accounts,Allowance for doubtful accounts-short-term loans
jppfs_cor:ShortTermLoansReceivableNet,短期貸付金（純額）,"Short-term loans receivable, net","Short-term loans receivable, net"
jppfs_cor:AdvancePaymentsTrade,前渡金,Advance payments - trade,Advance payments-trade
jppfs_cor:PrepaidExpenses,前払費用,Prepaid expenses,Prepaid expenses
jppfs_cor:DeferredTaxAssetsCA,繰延税金資産、流動資産,Deferred tax assets,Deferred tax assets-CA
jppfs_cor:ShortTermReceivablesFromDirectorsAndOtherEDU,役員等短期債権、学校法人,Short-term receivables from directors and other,Short-term receivables from directors and other-EDU
jppfs_cor:AllowanceForDoubtfulAccountsShortTermReceivablesFromDirectorsAndOtherEDU,貸倒引当金、役員等短期債権、学校法人,Allowance for doubtful accounts,Allowance for doubtful accounts-short-term receivables from directors and other-EDU
jppfs_cor:ShortTermReceivablesFromDirectorsAndOtherNetEDU,役員等短期債権（純額）、学校法人,"Short-term receivables from directors and other, net","Short-term receivables from directors and other, net-EDU"
jppfs_cor:OtherCA,その他、流動資産,Other,Other-CA
jppfs_cor:AllowanceForDoubtfulAccountsCA,貸倒引当金、流動資産、一括控除,Allowance for doubtful accounts,Allowance for doubtful accounts-CA-by group
jppfs_cor:CurrentAssets,流動資産,Current assets,Current assets
jppfs_cor:Assets,資産,Assets,Assets
jppfs_cor:LiabilitiesAbstract,負債の部 [タイトル項目],Liabilities,Liabilities [abstract]
jppfs_cor:NoncurrentLiabilitiesAbstract,固定負債 [タイトル項目],Non-current liabilities,Non-current liabilities [abstract]
jppfs_cor:LongTermLoansPayable,長期借入金,Long-term loans payable,Long-term loans payable
jppfs_cor:LongTermLoansPayableToSubsidiariesAndAffiliates,関係会社長期借入金,Long-term loans payable to subsidiaries and associates,Long-term loans payable to subsidiaries and associates
jppfs_cor:SchoolBondsPayableNCLEDU,学校債、固定負債、学校法人,School bonds payable,School bonds payable-NCL-EDU
jppfs_cor:LeaseObligationsNCL,リース債務、固定負債,Lease obligations,Lease obligations-NCL
jppfs_cor:DeferredTaxLiabilitiesNCL,繰延税金負債、固定負債,Deferred tax liabilities,Deferred tax liabilities-NCL
jppfs_cor:ProvisionNCLAbstract,引当金、固定負債 [タイトル項目],Provision,Provision-NCL [abstract]
jppfs_cor:ProvisionForRetirementBenefits,退職給付引当金,Provision for retirement benefits,Provision for retirement benefits
jppfs_cor:ProvisionNCL,引当金、固定負債,Provision,Provision-NCL
jppfs_cor:LongTermLoansPayableToDirectorsAndOtherEDU,役員等長期借入金、学校法人,Long-term loans payable to directors and other,Long-term loans payable to directors and other-EDU
jppfs_cor:OtherNCL,その他、固定負債,Other,Other-NCL
jppfs_cor:NoncurrentLiabilities,固定負債,Non-current liabilities,Non-current liabilities
jppfs_cor:CurrentLiabilitiesAbstract,流動負債 [タイトル項目],Current liabilities,Current liabilities [abstract]
jppfs_cor:ShortTermLoansPayable,短期借入金,Short-term loans payable,Short-term loans payable
jppfs_cor:SchoolBondsPayableCLEDU,学校債、流動負債、学校法人,School bonds payable,School bonds payable-CL-EDU
jppfs_cor:NotesPayableTrade,支払手形,Notes payable - trade,Notes payable-trade
jppfs_cor:LeaseObligationsCL,リース債務、流動負債,Lease obligations,Lease obligations-CL
jppfs_cor:AccountsPayableOther,未払金,Accounts payable - other,Accounts payable-other
jppfs_cor:AccruedExpenses,未払費用,Accrued expenses,Accrued expenses
jppfs_cor:AdvancesReceived,前受金,Advances received,Advances received
jppfs_cor:DepositsReceivedAbstractEDU,預り金、学校法人 [タイトル項目],Deposits received,Deposits received-EDU [abstract]
jppfs_cor:FundForSchoolExcursionDepositsReceivedEDU,修学旅行積立金、預り金、学校法人,Fund for school excursion,Fund for school excursion-deposits received-EDU
jppfs_cor:SubsidiesForScientificResearchDepositsReceivedEDU,科学研究費補助金、預り金、学校法人,Subsidies for scientific research,Subsidies for scientific research-deposits received-EDU
jppfs_cor:DepositsReceived,預り金,Deposits received,Deposits received
jppfs_cor:IncomeTaxesPayable,未払法人税等,Income taxes payable,Income taxes payable
jppfs_cor:AccruedConsumptionTaxes,未払消費税等,Accrued consumption taxes,Accrued consumption taxes
jppfs_cor:DeferredTaxLiabilitiesCL,繰延税金負債、流動負債,Deferred tax liabilities,Deferred tax liabilities-CL
jppfs_cor:ProvisionCLAbstract,引当金、流動負債 [タイトル項目],Provision,Provision-CL [abstract]
jppfs_cor:ProvisionForBonuses,賞与引当金,Provision for bonuses,Provision for bonuses
jppfs_cor:ProvisionCL,引当金、流動負債,Provision,Provision-CL
jppfs_cor:ShortTermLoansPayableToDirectorsAndOtherEDU,役員等短期借入金等、学校法人,Short-term loans payable to directors and other,Short-term loans payable to directors and other-EDU
jppfs_cor:OtherCL,その他、流動負債,Other,Other-CL
jppfs_cor:CurrentLiabilities,流動負債,Current liabilities,Current liabilities
jppfs_cor:Liabilities,負債,Liabilities,Liabilities
jppfs_cor:NetAssetsAbstract,純資産の部 [タイトル項目],Net assets,Net assets [abstract]
jppfs_cor:ValuationAndTranslationAdjustmentsAbstract,評価・換算差額等 [タイトル項目],Valuation and translation adjustments,Valuation and translation adjustments [abstract]
jppfs_cor:ValuationDifferenceOnAvailableForSaleSecurities,その他有価証券評価差額金,Valuation difference on available-for-sale securities,Valuation difference on available-for-sale securities
jppfs_cor:DeferredGainsOrLossesOnHedges,繰延ヘッジ損益,Deferred gains or losses on hedges,Deferred gains or losses on hedges
jppfs_cor:ValuationAndTranslationAdjustments,評価・換算差額等,Valuation and translation adjustments,Valuation and translation adjustments
jppfs_cor:OtherAssetsLiabilitiesDifferenceEDU,その他資産負債差額、学校法人,Other assets liabilities difference,Other assets liabilities difference-EDU
jppfs_cor:NonControllingInterests,非支配株主持分,Non-controlling interests,Non-controlling interests
jppfs_cor:NetAssets,純資産,Net assets,Net assets
jppfs_cor:LiabilitiesAndNetAssets,負債純資産,Liabilities and net assets,Liabilities and net assets
nan,,,
nan,,,
名前空間プレフィックス:要素名,冗長ラベル（日本語）,標準ラベル（英語）,冗長ラベル（英語）
jppfs_cor:StatementOfIncomeAbstract,損益計算書 [タイトル項目],Statement of income,Statement of income [abstract]
jppfs_cor:StatementOfIncomeTable,損益計算書 [表],Statement of income,Statement of income [table]
jppfs_cor:StatementOfIncomeLineItems,損益計算書 [表示項目],Statement of income,Statement of income [line items]
jppfs_cor:OperatingIncomeAndLossAbstractEDU,事業損益（事業収益及び事業費用）、学校法人 [タイトル項目],Operating revenue and expenses,Operating revenue and expenses - EDU [abstract]
jppfs_cor:EducationAndResearchAndIncidentalOperatingIncomeAndLossAbstractEDU,教育研究・附属事業損益、学校法人 [タイトル項目],Education and research and incidental operating revenue and expenses,Education and research and incidental operating revenue and expenses - EDU [abstract]
jppfs_cor:EducationAndResearchAndIncidentalOperatingRevenueAbstractEDU,教育研究・附属事業収益、学校法人 [タイトル項目],Education and research and incidental operating revenue,Education and research and incidental operating revenue-EDU [abstract]
jppfs_cor:StudentFeesEDU,学生生徒等納付金、学校法人,Student fees,Student fees-EDU
jppfs_cor:ProcessingFeesEDU,手数料、学校法人,Processing fees,Processing fees-EDU
jppfs_cor:DonationsEDU,寄附金、学校法人,Donations,Donations-EDU
jppfs_cor:SubsidiesEDU,補助金、学校法人,Subsidies,Subsidies-EDU
jppfs_cor:OtherRevenueEducationResearchAndIncidentalEDU,その他、教育研究・附属事業収益、学校法人,Other,"Other-revenue-education, research and incidental-EDU"
jppfs_cor:EducationAndResearchAndIncidentalOperatingRevenueEDU,教育研究・附属事業収益、学校法人,Education and research and incidental operating revenue,Education and research and incidental operating revenue-EDU
jppfs_cor:EducationAndResearchAndIncidentalOperatingExpensesAbstractEDU,教育研究・附属事業費用、学校法人 [タイトル項目],Education and research and incidental operating expenses,Education and research and incidental operating expenses-EDU [abstract]
jppfs_cor:PersonalExpensesEDUEDU,人件費、学校法人,Personnel expenses,Personnel expenses-EDU
jppfs_cor:EducationAndResearchExpensesEDU,教育研究経費、学校法人,Education and research expenses,Education and research expenses-EDU
jppfs_cor:ManagementExpensesEDU,管理経費、学校法人,Management expenses,Management expenses-EDU
jppfs_cor:EducationAndResearchAndIncidentalOperatingExpensesEDU,教育研究・附属事業費用、学校法人,Education and research and incidental operating expenses,Education and research and incidental operating expenses-EDU
jppfs_cor:EducationAndResearchAndIncidentalOperatingIncomeEDU,教育研究・附属事業利益又は教育研究・附属事業損失（△）、学校法人,Education and research and incidental operating profit (loss),Education and research and incidental operating profit (loss) - EDU
jppfs_cor:ProfitEarningOperatingIncomeAndLossAbstractEDU,収益事業損益、学校法人 [タイトル項目],Profit-earning operating revenue and expenses,Profit-earning operating revenue and expenses - EDU [abstract]
jppfs_cor:ProfitEarningOperatingRevenueEDU,収益事業収益、学校法人,Profit-earning operating revenue,Profit-earning operating revenue-EDU
jppfs_cor:ProfitEarningOperatingExpensesEDU,収益事業費用、学校法人,Profit-earning operating expenses,Profit-earning operating expenses-EDU
jppfs_cor:ProfitEarningOperatingIncomeEDU,収益事業利益又は収益事業損失（△）、学校法人,Profit-earning operating profit (loss),Profit-earning operating profit (loss) - EDU
jppfs_cor:OperatingIncomeEDU,事業利益又は事業損失（△）、学校法人,Operating profit (loss),Operating profit (loss) - EDU
jppfs_cor:NonOperatingIncomeAbstractEDU,事業外収益、学校法人 [タイトル項目],Non-operating income,Non-operating income-EDU [abstract]
jppfs_cor:InterestAndDividendsIncomeNOI,受取利息及び配当金、営業外収益,Interest and dividend income,Interest and dividend income-NOI
jppfs_cor:OtherNOIEDU,その他、事業外収益、学校法人,Other,Other-NOI-EDU
jppfs_cor:NonOperatingIncomeEDU,事業外収益、学校法人,Non-operating income,Non-operating income-EDU
jppfs_cor:NonOperatingExpensesAbstractEDU,事業外費用、学校法人 [タイトル項目],Non-operating expenses,Non-operating expenses-EDU [abstract]
jppfs_cor:InterestExpensesNOE,支払利息、営業外費用,Interest expenses,Interest expenses-NOE
jppfs_cor:OtherNOEEDU,その他、事業外費用、学校法人,Other,Other-NOE-EDU
jppfs_cor:NonOperatingExpensesEDU,事業外費用、学校法人,Non-operating expenses,Non-operating expenses-EDU
