タクソノミ,冗長ラベル（日本語）,標準ラベル（英語）,冗長ラベル（英語）
jppfs_cor:OrdinaryIncome,経常利益又は経常損失（△）,Ordinary profit (loss),Ordinary profit (loss)
jppfs_cor:ExtraordinaryIncomeAbstract,特別利益 [タイトル項目],Extraordinary income,Extraordinary income [abstract]
jppfs_cor:GainOnSalesOfNoncurrentAssetsEI,固定資産売却益、特別利益,Gain on sales of non-current assets,Gain on sales of non-current assets-EI
jppfs_cor:OtherEI,その他、特別利益,Other,Other-EI
jppfs_cor:ExtraordinaryIncome,特別利益,Extraordinary income,Extraordinary income
jppfs_cor:ExtraordinaryLossAbstract,特別損失 [タイトル項目],Extraordinary losses,Extraordinary losses [abstract]
jppfs_cor:LossOnSalesOfNoncurrentAssetsEL,固定資産売却損、特別損失,Loss on sales of non-current assets,Loss on sales of non-current assets-EL
jppfs_cor:ImpairmentLossEL,減損損失、特別損失,Impairment loss,Impairment loss-EL
jppfs_cor:LossOnDisasterEL,災害による損失、特別損失,Loss on disaster,Loss on disaster-EL
jppfs_cor:OtherEL,その他、特別損失,Other,Other-EL
jppfs_cor:ExtraordinaryLoss,特別損失,Extraordinary losses,Extraordinary losses
jppfs_cor:IncomeBeforeIncomeTaxes,税引前当期純利益又は税引前当期純損失（△）,Profit (loss) before income taxes,Profit (loss) before income taxes
jppfs_cor:IncomeTaxes,法人税等,Income taxes,Income taxes
jppfs_cor:IncomeTaxesCurrent,法人税、住民税及び事業税,Income taxes - current,Income taxes-current
jppfs_cor:IncomeTaxesDeferred,法人税等調整額,Income taxes - deferred,Income taxes-deferred
jppfs_cor:ProfitLoss,当期純利益又は当期純損失（△）（平成26年3月28日財規等改正後）,Profit (loss),Profit (loss) (after amendment dated 2014-03-28)
jppfs_cor:ProfitAttributableToAbstract,内訳、当期純利益 [タイトル項目],Profit attributable to,Profit attributable to [abstract]
jppfs_cor:ProfitLossAttributableToNonControllingInterests,非支配株主に帰属する当期純利益又は非支配株主に帰属する当期純損失（△）,Profit (loss) attributable to non-controlling interests,Profit (loss) attributable to non-controlling interests
jppfs_cor:ProfitLossAttributableToOwnersOfParent,親会社株主に帰属する当期純利益又は親会社株主に帰属する当期純損失（△）,Profit (loss) attributable to owners of parent,Profit (loss) attributable to owners of parent
nan,,,
nan,,,
名前空間プレフィックス:要素名,冗長ラベル（日本語）,標準ラベル（英語）,冗長ラベル（英語）
jppfs_cor:StatementOfChangesInNetAssetsAbstract,純資産変動計算書 [タイトル項目],Statement of changes in net assets,Statement of changes in net assets [abstract]
jppfs_cor:StatementOfChangesInNetAssetsTable,純資産変動計算書 [表],Statement of changes in net assets,Statement of changes in net assets [table]
jppfs_cor:ComponentsOfEquityAxis,純資産の内訳項目 [軸],Components of equity,Components of equity [axis]
jppfs_cor:NetAssetsMember,純資産 [メンバー],Net assets,Net assets [member]
jppfs_cor:ValuationAndTranslationAdjustmentsMember,評価・換算差額等 [メンバー],Valuation and translation adjustments,Valuation and translation adjustments [member]
jppfs_cor:ValuationDifferenceOnAvailableForSaleSecuritiesMember,その他有価証券評価差額金 [メンバー],Valuation difference on available-for-sale securities,Valuation difference on available-for-sale securities [member]
jppfs_cor:DeferredGainsOrLossesOnHedgesMember,繰延ヘッジ損益 [メンバー],Deferred gains or losses on hedges,Deferred gains or losses on hedges [member]
jppfs_cor:OtherAssetsLiabilitiesDifferenceEDUMember,その他資産負債差額、学校法人 [メンバー],Other assets liabilities difference,Other assets liabilities difference-EDU [member]
jppfs_cor:NonControllingInterestsMember,非支配株主持分 [メンバー],Non-controlling interests,Non-controlling interests [member]
jppfs_cor:StatementOfChangesInNetAssetsLineItems,純資産変動計算書 [表示項目],Statement of changes in net assets,Statement of changes in net assets [line items]
jppfs_cor:NetAssets,純資産,Net assets,Net assets
jppfs_cor:ChangesOfItemsDuringThePeriodAbstract,当期変動額 [タイトル項目],Changes of items during period,Changes of items during period [abstract]
jppfs_cor:ProfitLossAttributableToOwnersOfParent,親会社株主に帰属する当期純利益又は親会社株主に帰属する当期純損失（△）,Profit (loss) attributable to owners of parent,Profit (loss) attributable to owners of parent
jppfs_cor:ProfitLoss,当期純利益又は当期純損失（△）（平成26年3月28日財規等改正後）,Profit (loss),Profit (loss) (after amendment dated 2014-03-28)
jppfs_cor:TotalChangesOfItemsDuringThePeriod,当期変動額合計,Total changes of items during period,Total changes of items during period
nan,,,
nan,,,
名前空間プレフィックス:要素名,冗長ラベル（日本語）,標準ラベル（英語）,冗長ラベル（英語）
jppfs_cor:StatementOfCashFlowsAbstract,キャッシュ・フロー計算書 [タイトル項目],Statement of cash flows,Statement of cash flows [abstract]
jppfs_cor:StatementOfCashFlowsTable,キャッシュ・フロー計算書 [表],Statement of cash flows,Statement of cash flows [table]
jppfs_cor:StatementOfCashFlowsLineItems,キャッシュ・フロー計算書 [表示項目],Statement of cash flows,Statement of cash flows [line items]
jppfs_cor:NetCashProvidedByUsedInOperatingActivitiesAbstractEDU,事業活動によるキャッシュ・フロー、学校法人 [タイトル項目],Cash flows from operating activities,Cash flows from operating activities-EDU [abstract]
jppfs_cor:SubtotalOpeCF,小計、営業活動によるキャッシュ・フロー,Subtotal,Subtotal-OpeCF
jppfs_cor:ProceedsFromEducationAndResearchAndIncidentalOperationOpeCFEDU,教育研究・附属事業収入、事業活動によるキャッシュ・フロー、学校法人,Proceeds from education and research and incidental operation,Proceeds from education and research and incidental operation-OpeCF-EDU
jppfs_cor:ProceedsFromStudentFeesOpeCFEDU,学生生徒等納付金収入、事業活動によるキャッシュ・フロー、学校法人,Proceeds from student fees,Proceeds from student fees-OpeCF-EDU
jppfs_cor:ProceedsFromProcessingFeesOpeCFEDU,手数料の受入れによる収入、事業活動によるキャッシュ・フロー、学校法人,Proceeds from processing fees,Proceeds from processing fees-OpeCF-EDU
jppfs_cor:ProceedsFromDonationsOpeCFEDU,寄附金の受入れによる収入、事業活動によるキャッシュ・フロー、学校法人,Proceeds from donations,Proceeds from donations-OpeCF-EDU
jppfs_cor:ProceedsFromSubsidiesOpeCFEDU,補助金の受入れによる収入、事業活動によるキャッシュ・フロー、学校法人,Proceeds from subsidies,Proceeds from subsidies-OpeCF-EDU
jppfs_cor:OtherProceedsFromEducationAndResearchAndIncidentalOperationOpeCFEDU,その他の教育研究・附属事業収入、事業活動によるキャッシュ・フロー、学校法人,Other proceeds from education and research and incidental operation,Other proceeds from education and research and incidental operation-OpeCF-EDU
jppfs_cor:PaymentsForEducationAndResearchAndIncidentalOperationOpeCFEDU,教育研究・附属事業支出、事業活動によるキャッシュ・フロー、学校法人,Payments for education and research and incidental operation,Payments for education and research and incidental operation-OpeCF-EDU
jppfs_cor:PaymentsForPersonalExpensesOpeCFEDU,人件費の支出、事業活動によるキャッシュ・フロー、学校法人,Payments for personnel expenses,Payments for personnel expenses-OpeCF-EDU
jppfs_cor:PaymentsForEducationAndResearchExpensesOpeCFEDU,教育研究経費の支出、事業活動によるキャッシュ・フロー、学校法人,Payments for education and research expenses,Payments for education and research expenses-OpeCF-EDU
jppfs_cor:PaymentsForManagementExpensesOpeCFEDU,管理経費の支出、事業活動によるキャッシュ・フロー、学校法人,Payments for management expenses,Payments for management expenses-OpeCF-EDU
jppfs_cor:ProceedsFromProfitEarningOperationOpeCFEDU,収益事業収入、事業活動によるキャッシュ・フロー、学校法人,Proceeds from profit-earning operation,Proceeds from profit-earning operation-OpeCF-EDU
jppfs_cor:PaymentsForProfitEarningOperationOpeCFEDU,収益事業支出、事業活動によるキャッシュ・フロー、学校法人,Payments for profit-earning operation,Payments for profit-earning operation-OpeCF-EDU
jppfs_cor:DecreaseIncreaseInAccountsReceivableOpeCFEDU,未収入金の増減額（△は増加）、事業活動によるキャッシュ・フロー、学校法人,Decrease (increase) in accounts receivable,Decrease (increase) in accounts receivable-OpeCF-EDU
jppfs_cor:NetCashProvidedByUsedInOperatingActivitiesEDU,事業活動によるキャッシュ・フロー、学校法人,Net cash provided by (used in) operating activities,Net cash provided by (used in) operating activities-EDU
jppfs_cor:NetCashProvidedByUsedInFacilitiesMaintenanceAndInvestmentActivitiesAbstractEDU,施設等整備・投資活動によるキャッシュ・フロー、学校法人 [タイトル項目],Cash flows from facilities maintenance and investing activities,Cash flows from facilities maintenance and investing activities-EDU [abstract]
jppfs_cor:ProceedsFromFacilitiesSubsidiesInvCFEDU,施設設備補助金の受入れによる収入、施設等整備・投資活動によるキャッシュ・フロー、学校法人,Proceeds from facilities subsidies,Proceeds from facilities subsidies-InvCF-EDU
jppfs_cor:ProceedsFromSpecialContributionInvCFEDU,特別寄附金の受入れによる収入、施設等整備・投資活動によるキャッシュ・フロー、学校法人,Proceeds from special contribution,Proceeds from special contribution-InvCF-EDU
jppfs_cor:PaymentOfReservedAssetsForFacilitiesInvCFEDU,施設設備引当特定資産への支出、施設等整備・投資活動によるキャッシュ・フロー、学校法人,Payment of reserved assets for facilities,Payment of reserved assets for facilities-InvCF-EDU
jppfs_cor:ProceedsFromReservedAssetsForFacilitiesInvCFEDU,施設設備引当特定資産からの収入、施設等整備・投資活動によるキャッシュ・フロー、学校法人,Proceeds from reserved assets for facilities,Proceeds from reserved assets for facilities-InvCF-EDU
jppfs_cor:NetCashProvidedByUsedInFacilitiesMaintenanceAndInvestmentActivitiesEDU,施設等整備・投資活動によるキャッシュ・フロー、学校法人,Net cash provided by (used in) facilities maintenance and investing activities,Net cash provided by (used in) facilities maintenance and investing activities-EDU
jppfs_cor:NetCashProvidedByUsedInFinancingActivitiesAbstract,財務活動によるキャッシュ・フロー [タイトル項目],Cash flows from financing activities,Cash flows from financing activities [abstract]
jppfs_cor:ProceedsFromIssuanceOfSchoolBondsFinCFEDU,学校債の発行による収入、財務活動によるキャッシュ・フロー、学校法人,Proceeds from issuance of school bonds,Proceeds from issuance of school bonds-FinCF-EDU
jppfs_cor:RedemptionOfSchoolBondsFinCFEDU,学校債の償還による支出、財務活動によるキャッシュ・フロー、学校法人,Redemption of school bonds,Redemption of school bonds-FinCF-EDU
